"The food was very good, a great deal, and the place its self was great."
Terrible would be a compliment!
The place is a lot of fun.
"However, I think Jeckll and Hydes t is one of those places that is fun to do once."
The service was friendly and the atmosphere was casual.
please don't fool us.
not sure why this restaurant would be rated that highly.
"Love the scene first off- the place has a character and nice light to it..very fortunate, location wise."
This place has great indian chinese food.
"The Four Seasons has history and it is a sort of landmark of New York City restaurants, but trust me, they will charge you through the nose just so that you can say ""I've been to the four seasons restaurant""."
Pizza was a little soggy.
Can't wait to go back.
I will go back to Suan soon!
The wine list is also really nice.
Great bagels made the old-fashioned way.
This place...god where do i begin.
Quick and friendly service.
"My father had the flank steak which was very good, and my mother had the swordfish."
"Bagels are ok, but be sure not to make any special requests!"
The sake’s complimented the courses very well and is successfully easing me into the sake world.
"Food is usually very good, though ocasionally I wondered about freshmess of raw vegatables in side orders."
It's simply the best meal in NYC.
The waiter delivered our food while holding what appeared to be a plastic bag of garbage in one hand.
"However, our $14 drinks were were horrible!"
"Both times I was extremely dissappointed by the service, which was boarderline rude."
it's delicious!
"Going to Bark is always worth the train ride, and will make your tongue and belly very happy!"
Great Atmosphere
The service was the only thing good about this restaurant.
First went here to enjoy their garden terrace.
I almost hesititate to write a review because the atmosphere was so great and I would hate for it too become to crowded.
The only thing more wonderful than the food (which is exceptional) is the service.
The veal was incredible last night.
I would highly recommend this place!
"For a restaurant with such a good reputation and that is usually so packed, there was no reason for such a lack of intelligent customer service."
"The staff was accomodating, the food was absolutely delicious and the place is lovely."
"Inside is a little cramped, but to be expected."
"A gentleman, maybe the manager, came to our table, and without so much as a smile or greeting asked for our order."
We all felt it was worth it.
I have never been so disgusted by both food an service.
"I am not a vegetarian but, almost all the dishes were great."
"La Rosa waltzes in, and I think they are doing it the best."
The design of the space is good.
"The vibe is very relaxed and cozy, service was great and the food was excellent!"
The decor is very simple but comfortable.
"The large selection of bruschettas, paninis, tramezzinis keep the palate from stagnating."
The farro salad and the mashed yukon potatoes were also extremely tasty.
We had a very nice time.
They wouldnt even let me finish my glass of wine before offering another.
It's to die for!
Try the lobster teriyaki and the rose special roll.
I absolutely Loved this place.
Although we were looking for regular lettuce and some walnuts the salads we got were great.
and yes Dal Bukhara is so dam good and so are all the kababs.
We were ushered to the bar to wait momentarily and upon arrival were so excited.
I also recommend the rice dishes or the different varieties of congee (rice porridge).
"For instance, plates were just dumped on the table, I was handed the wine list upside down, etc.... "
We were then shooed inside.
"I also ordered the Change Mojito, which was out of this world."
"The space kind of feels like an Alice in Wonderland setting, without it trying to be that."
Pizza here is consistently good.
I book a gorgeous white organza tent which included a four course prix fix menu which we enjoyed a lot.
Always great service!
Very pleased
"I must say I am surprised by the bad reviews of the restaurant earlier in the year, though."
Service is not what you are coming here for...
I really loved the different and inovated touch that's the cheff gives to the food.
Consistently good Japanese Tapas.
"In the summer months, the back garden area is really nice."
It just wasn't Thai.
"In about 12 minutes, the thing is gone."
The main entree was also very good.
The appetizers are also delicious!
But the best pork souvlaki I ever had is the main thing.
Delivery is fast too.
It's somewhere you can eat and be happy.
Just go to Yamato and order the Red Dragon Roll.
"We did tip, I guess the model/waitress just wanted more and complained to the manager."
Ravioli was good...but I have to say that I found everything a bit overpriced.
Super YUMMY Pizza!
"Sometimes tables don't understand his sense of humor but it's refreshing to have a server who has personality, professionalism, and respects the privacy of your dinner."
"the salads are delicious, both refreshing and very spicy."
Some Pineapple covered in a glaze of some kind and some pear tart thing Not impressive at all.
"This place has totally weird decor, stairs going up with mirrored walls - I am surprised how no one yet broke their head or fall off the stairs - mirrored walls make you dizzy and delusional..."
"The tables are crammed way too close, the menu is typical of any Italian restaurant, and the wine list is simply overpriced."
"The restaurant has a Family feel, not least with regard to the portions which are enormous; the veal alone could have single-handedly solved third world famine."
I would highly recommend it.
"It is set far from the small street it's on, and there is no traffic noise."
Everything on the menu is great. 
"I'm a friendly person, so I wouldn't mind had she not been so nasty and gotten so personal. "
Good for dates or with friends.
my favorite place lol
We've tried before but it always packed and doesn't take reservations.
"The chicken pot pie is excpetiona, the cheeseburger huge and delictable, and the service professional wan warm."
"The portion sizes here are huge, and the sushi is good."
"Food took some time to prepare, all worth waiting for."
I thanked my friend who recommended me this restaurant and will certainly recommend it to others.
Quite simply it's like stepping out of Manhattan and into a haven of tranquility.
Fantastic!
"Inexpensive, unassuming, great time!"
Don't be fooled by crowds of people.
"The pastas are incredible, the risottos (particularly the sepia) are fantastic and the braised rabbit is amazing."
The hostess was very pleasant.
"To be completely fair, the only redeeming factor was the food, which was above average, but couldn't make up for all the other deficiencies of Teodora."
Patroon features a nice cigar bar and has great staff.
Check this place out!
Went there with my wife and we had to wait for a table even though you could see there many that were empty with not reservation sigh on them.
So what you really end up paying for is the restaurant not the food.
Too bad I had paid an extra $2 for the stone bowl.
"Maybe it was the great company (I had friends visiting from Philly – yes, it was not a date this time) or the super reasonable price point, but I just can’t say enough good things about this brasserie."
wont come back again for sure!
"Rather than preparing vegetarian dish, the chef presented me with a plate of steamed vegetables (minus sauce, seasoning, or any form or aesthetic presentation)."
I ordered the vitello alla marsala and I was pretty impressed.
"I have reservations about the all you can eat deal, however -- the choices are fairly limited and you can probably order more food than you can eat for less than $18 by just going off the menu."
"From the spectacular caviar to the hospitable waitstaff, I felt like royalty and enjoyed every second of it."
Not what I would expect for the price and prestige of this location.
For each course we waited over 1/2 hour to 45 minutes and were never offered a drink.
But the pizza is way to expensive.
"As BFC doesn't take reservations you almost always have to wait by the bar - and be abused by the front of house staff until you are seated, which can be over an hour later!"
The service was excellent and the food was delicious.
"If we were to move from the upper east side, we would genuinely miss this restaurant."
"Overall the food quality was pretty good, though I hear the salmon is much better when it hasn't sat cooling in front of the guest."
"The DJ is awesome, I have been there for my birthday and a bunch of other times with friends and I keep going back."
Prices are in line.
I think the pizza is so overrated and was under cooked.
Well...they can run but they can't hide.
"Not much of a selection of bottled beer either, we went with Brahma. "
This has got to be one of the most overrated restaurants in Brooklyn.
How is this palce still open?
I CAN EAT HERE EVERY DAY OF THE WEEK REALLY LOL LOVE THIS PLACE ...)
"peppers, onions, relish, chilli, cheeses, you NAME it."
"It was the first place we ate on our first trip to New York, and it will be the last place we stop as we head out of town on our next trip to New York."
The dining room is quietly elegant with no music to shout over -- how refreshing!
"We were worried we would have trouble getting in, but somehow managed to have a short wait."
I am actually offended to have spent so much money on such a bad experience.
This is the perfect date spot for Williamsburg couples.
For starters they delivered us someone else's order.
"All the various Greek and Cypriot dishes are excellent, but the gyro is the reason to come--if you don't eat one your trip was wasted."
Just not good at all.
The manager was rude and handled the situation extremely poorly.
"If you're into being lost when you're just five feet from your table then hey, that's a good thing."
"also it's great to have dinner in a very romantic and confortable place, the service it's just perfect...they're so frendly that we never want to live the place!"
The rolls are creative and I have yet to find another sushi place that serves up more inventive yet delicious japanese food.
sometimes i get good food and ok service.
"It is nearly impossible to get a table, so if you ever have the chance to go here for dinner, DO NOT pass it up."
"I can't believe that it was, but please put the bag down before delivering food!"
Food is excellent.
"Best Indian Chinese in the city, by far!"
The lunch buffet is expensive but is deff worth it.
"The ambience was nice, but service wasn't so great."
Not a very fancy place but very good Chinese style Indian food.
Who has room for Cheesesticks with the best pizza in NYC!
"When asked about how a certain dish was prepared in comparison to a similar at other thai restaurants, he replied this is not Mcdonald's, every place makes things differently "
"It's just average, just shredded, no seasoning on it."
Ingredients are organic which is a real plus for me.
Definitely a great spot for a nice occasion or date.
We didn't look like the other patrons in there so unfortunately I think that may have been part of the problem.
not only is the food
What more could you want?
"When my dessert came, there was a candle in it - not because anyone asked for one - but because the waiter must have seen me opening my birthday card and gift, and said he knew it was a special occassion of some sort."
the waitstaffs are nice though.
I go twice a month!
"It's a little out of our price range for dining there except on special occasions, but we've eaten there 6 times in the last 2 years. "
"I wanted to go there to see if it was worth it and sadly, curiousity got the best of me and I paid dearly for it."
Best Indian Restaurant in the City
The food was exceptional.
Everyone must come here at least once.
This place would be so much better served by being run by a group that actually understands customer service.
Big Wong is a great place to eat and fill your stomach.
"At first glance this place seems a bit pricey for a hot dog joint, but at Bark you don't just get your average hot dog."
I can't wait to go back.
I've been many time and have never been disappointed.
"Fabulous decor - makes you feel like you're in a trendy Manhattan restaurant, very very good food, cheaply-priced, generally friendly staff, and if you're a Manhattanite, or spend most of your time in Manhattan, Rice Avenue will make you feel at home.....very Soho/Village/Upper West Side minus the expensive prices and pretentious clientele.....all on Roosevelt Avenue!"
"We thought the dessert would be better, Wrong!"
Best In ALL of NYC
"The last two times I ordered from here my food was soo spicy that  I could barely eat it, and the spice took away from the flavor of the dish."
The bar is very well stocked with interesting beers and well priced wines.
It's a rather cramped and busy restaurant and it closes early.
and you can't beat the prices.
"The seafood is amazing, there's a good wine list, and the ever-changing menu always offers some great surprises."
I'll be back for sure.
I HAVE NEVER EVER HAD SUCH AN UNPLEASANT EXPERIENCE.
Best drumsticks over rice and sour spicy soup in town!
Surprisingly nothing could be further from the truth.
Less than three minutes passed before I found myself doubled over the toilet.
Wine list selection is good and wine-by-the-glass was generously filled to the top.
"When we sat, we got great and fast service."
"Creative, consistent, fresh."
"Try the congee and the donut like deep fried dough they call Ow Ley Soh, a delicious and sweet tasting bread."
"Their calzones are horrific, bad, vomit-inducing, YUCK."
The exotic food is beautifully presented and is a delight in delicious combinations.
Wine list is extensive without being over-priced.
The have a great cocktail with Citrus Vodka and lemon and lime juice and mint leaves that is to die for!
"Service was devine, oysters where a sensual as they come, and the price can't be beat!!!"
"The food however, is what one might expect."
Great Indian food
Salads were fantastic.
The nakgi-bokum was horrible.
Service was slow had to wait to order and get food although not crowded.
everyone was cheerfully cooperative and helpful.
Love YUKA.
We went around 9:30 on a Friday and it had died down a bit by then so the service was great!
"The manager finally said he would comp the two glasses of wine (which cost less than the food), and made it seem like a big concession."
"This is the MOST wonderful restaurant in all of New York City, not just Brooklyn..."
Worth visiting the 1st Ave spot because it is the original store.
Try sushimi cucumber roll.
It's a nice place to relax and have conversation.
"Still, any quibbles about the bill were off-set by the pour-your-own measures of liquers which were courtesey of the house..."
Only complaint is the pricing--I believe it would be more reasonable to pay a dollar less on each item listed on the menu.
Excellent food for great prices
"I like the ambience, it's very dark and original."
I have been going there since it opened and I can't get enough.
Service is not what one would expect from a joint in this price category.
"Yes, they use fancy ingredients, but even fancy ingredients don't make for good pizza unless someone knows how to get the crust right."
I have been going back again and again.
"The service is ok, some of the people didn't get what they asked for."
"Pizza - the only pizza in NYC that should not have additional toppings - the crust tastes like the best, freshly baked bread!"
"The place has a nice fit-out, some attractive furnishings and, from what I could tell, a reasonable wine list (I was given the food menu when I asked for the carte des vins)"
Try it!
Indoor was very cozy and cute.
great hot dogs..
"This place is pricey, and yes, the food is worth it; but the service makes you feel like you should be paying a quater of the price."
Your friends will thank you for introducing them to this gem!
Always busy but fast moving.
I loved this place!!
"Thalia is a beautiful restaurant with beautiful people serving you, but the food doesn't quite match up."
I have been to Roth's twice and both times were very disappointing.
We ordered some beef and noodle soup dishes from the Thai section of the menu but nothing we got was Thai.
i love their chicken pasta cant remember the name but is sooo good
Poor service and management
the crust was imazingly cooked well and pizza was fully loaded:):):)
"During the course of the past 3 months, the chef and staff changed and it was not for the better."
Excellent spot for holiday get togethers with co-workers or friends that you haven't seen in a while.
The food is reliable and the price is moderate.
"If you are the type of person who likes being scared and entertained, this is a great place to go and eat."
Even my Indian friend couldn't believe how good and tasty everything was.
The omlette for brunch is great...
it is not consistent.
Have the iced tea.
"The manager came to the table and said we can do what we want, so we paid for what we did enjoy, the drinks and appetizers, and walked out."
"Guacamole+shrimp appetizer was really great, we both had the filet, very good, didn't much like the frites that came with, but the filet was so good, neither of us cared."
"Yes, the prices are high, but I felt it was worth it."
Food was good not great not worth the wait or another visit
Myagi is one of my favorite restaurants in the City; the place the negative reviews describe sound like they were somewhere else.
"Even though its good seafood, the prices are too high."
Had no flavor and the staff is rude and not attentive.
"The waitress moved our table practically into the bathroom and when we asked to cancel our dinner orders because we did not want to eat sitting on the toilet, we were told no..."
"Kind, attentive wait staff."
"While it is understandable that every place is indeed different, there was not a need to be uncourteous to customers and downright rude."
Helpful service and average price per dish $10.
The food tasted very good.
The atmosphere is noisy and the waiters are literally walking around doing things as fast as they can.
This is one of the best comfort food places in the city.
"This restaurant was recommended by a local...as a matter of fact, he made the reservation for us and said we would not be disappointed!"
Definately check it out!!!
"I picked the Grilled Black Cod as my entree, which I absolutely devoured while someone commented that the Grilled Salmon dish was better."
You will find yourself returning quite often.
A real dissapointment.
"Service was prompt, friendly and great."
You can do it here.
Maggot in the food!
HIGHLY RECOMMENDED!!!!!
None was made so i hung up.
"With so many poor experiences to be had in the theater district, is truly an excellent find!"
first it took us a long time to find the place.
SO GOOD
"I showed it to the manager, and he smilingly apologized and brought us two free desserts (but did not ask us what we wanted and so brought the last two desserts we would have asked for)."
You can't go wrong with this place.
Unhygienic
food was luke warm.
Food was OK.
It is quite a spectacular scene i'll give them that.
Great Shabu Shabu
"Overall, excellent restaurant!"
"For the price, you cannot eat this well in Manhattan."
The shrimp scampi was excellent and the antipasti were plentiful.
"I didn't complain, I liked the atmosphere so much."
The Yellowtail was particularly good as well.
I am reluctant to write because I would not want my jem of a pizza place to become overcrowded.
"for 7 years they have put out the most tasty, most delicious food and kept it that way..."
"There was a small wait, but shorter than I expected."
I started out with a Bombay beer which was big enough for two.
"Nobody at this restaurant will give firm answers about anything and in the end, not one person takes responsibility for anything."
Over all it was a very nice romantic place .
"For the people who want great food plus great service, Roxy is a place to AVOID!"
Service was also very good.
It’s just you and your date and an occasional cute ‘excuse me’ before the waiter opens the little curtain to your booth!
"While finishing our meals which included a high-end bottle of wine, our son's fiance joined us for a glass of wine and dessert."
I would highly recommend.
I've been there three times and have always had wonderful experiences.
"A word to the wise: you can't dine here and disturb the maitre-D's sense of "" table turnover"", as whacked as it is, or else."
10
you should travel from the Bronx to try it...
"The whole set up is truly unprofessional and I wish Cafe Noir would get some good staff, because despite the current one this is a great place."
"Great service, great food."
"Also, they do not take credit card so come with cash!"
Lexicographers take note: a new and fascinating definition of rudeness is alive and flourishing right here in Brooklyn.
This place is so much fun.
"Leon is an East Village gem: casual but hip, with well prepared basic French bistro fare, good specials, a warm and lively atmosphere."
They smell like they stuff them with old canned vegetables like the spinach mushroom calzone.
"The crust is thin, the ingredients are fresh and the staff is friendly."
I take all my NYC guests to VT's.
I highly recommend it.
"This is one of my favorite spot, very relaxing the food is great all the times , celebrated my engagement and my wedding here , it was very well organized ."
"Although the tables may be closely situated, the candle-light, food-quality and service overcompensate."
I will be out with friends and all of a sudden I am hungry and I only crave one thing... their Pizza.
Rao's has the best service and atmosphere in NYC.
Can't wait to go back.
I recieved prompt service with a smile.
Prices too high for this cramped and unappealing resturant.
I highly recommend this beautiful place.
This is one of my favorite restaurants and it is not to be missed.
We didn't want a bottle of bubbly on a weekday so we each got little bottles of Korbett it was just enough. 
The food is so cheap and the waiters are nice.
"They are extremely rude, not even apologizing for the horrible service we got and handing us a bill well over $500 for some drinks adn their pita bread!"
We asked for sides which the waiter than admitted that he forgot to put in that part of our order.
The flavors robust and subtle.
"Even though the place is not beautiful, the food speaks for itself."
highly recommended.
My quesadilla tasted like it had been made by a three-year old with no sense of proportion or flavor.
"Calling the place Hampton Chutney Co. does warn you that these folks offer more style than substance, but in this unattractive room with unhelpful clerks there was a dearth of the former too."
Winnie and her staff are the best crew you can find serving you.
"those rolls were big, but not good and sashimi wasn't fresh."
"The bar drinks were Eh, ok to say the least."
Raymond the bartender rocks!
Noodle pudding is exactly the type of service and food I enjoy.
"We ate out in the back patio, which is worth it as it's cool and the music is hear well there."
I cannot imagine a friendlier staff working in a restaurant.
this is can became on e of the NY Italian Food fare institutions.
Big Wong gets big Ups for a fine establishment.
The potato balls were not dry at all... in fact it was buttery.
it was really good pizza.
Worth the trip from Manhattan.
"i know, you were too busy showing off your vintage tee shirt and looking bored, but my agenda is i'm here to eat and enjoy the company of friends, seeking a pleasant experience."
"Considering you will spend at least $60 a head, I expect better service. "
Very cozy and warm inside.....
The counter service is bad.
"We had half/half pizza, mine was eggplant and my friend had the buffalo and it was sooo huge for a small size pizza!"
The food now is inconsistent.
Loved it
"Their bagels are fine, but they are a little overcooked, and not really a 'special' bagel experience."
"Moules were excellent, lobster ravioli was VERY salty!"
The spicy Tuna roll is huge and probably the best that I've had at this price range.
"Again, no apology, no is there anything else I can get you, no can I get you a drink to make up for it, nothing!!!!"
Yakitori (bbq meats) is tasty too.
We won't go to this place again for a good meal.
Truly the mark of an attentive waiter.
I recommend this place to everyone.
"So, I switch with my boyfriend again to see if maybe I could stomach the meat and spinach again, but the spinach was so undercooked that I just could not bite through it."
"Just straight up cheap, good food."
"They have great rolls, the triple color and norwegetan rolls, are awesome and filling."
I have to say I have never had a disapointing meal here.
This place survives on reputation alone.
"Despite a slightly limited menu, everything prepared is done to perfection, ultra fresh and a work of food art."
The place is so cool and the service is prompt and curtious.
Service was also horrible and the ambience is not that great.
"service is friendly, and never had a problem walking in and getting a table."
Wretched and retching
Sushi experience was unbelievable with my fiance.
Go there to relax and feel like your somewhere else.
Chicken teriyaki had tomato or pimentos on top??
The atmosphere was great.
"Not only is the cuisine the best around, the service has always been attentive and charming."
The food is authentic Italian - delicious!
I asked for an open faced cheese sandwich and the manager basically told me to take my business elsewhere!
Mine was a little burnt but still delicious with goat cheese and panchetta (raddichio was kind of bitter though).
When we inquired about ports - the waitress listed off several but did not know taste variations or cost.
Best. Sushi. Ever.
The food arrived in about 15 minutes. 
