text,aspects,polarities
"Puedes encontrar desde un chuletón bien trabajado, pasando por unos pescados en su punto justo o irte a menús mas elaborados, llenos de sabor y contrastes sin adulteraciones en el sabor.",['FOOD'],['positive']
Relación calidad-precio fantástica.,['FOOD'],['positive']
Absolutamente recomendable.,['RESTAURANT'],['positive']
Todo óptimo.,['RESTAURANT'],['positive']
"Rioja (divino y de una cosecha ""excelente"").",['DRINKS'],['positive']
Este restaurante es uno de los valores más seguros de la cocina catalana en Barcelona.,['RESTAURANT'],['positive']
Siempre es excelso en su comida y perfecto en su servicio.,"['SERVICE', 'FOOD']","['positive', 'positive']"
El ambiente también es de maravilla.,['AMBIENCE'],['positive']
Hacia tiempo que no habia estado y la experiencia fue muy decepcionante.,['RESTAURANT'],['negative']
Extremadamente caro por el tipo de cocina.,['FOOD'],['negative']
"Croquetas oleosas, salmón marinado insulso y escaso láminas transparentes, alcachofas con almejas duras  y sosas de vivero cuando el precio del plato fue de 28€, el carpaccio de rape  testimonial.",['FOOD'],['negative']
El trato del maitre que nos tomó nota fue de muy poca profesionalidad impresionante y rozando la mala educación.,['SERVICE'],['negative']
me encanta.,['RESTAURANT'],['positive']
Un restaurante muy recomendable.,['RESTAURANT'],['positive']
La comida es deliciosa y las cantidades son más que aceptables.,['FOOD'],['positive']
Algo caro pero sin duda muy recomendable para comer bien en Barcelona.,"['RESTAURANT', 'FOOD']","['negative', 'positive']"
Prefiero no opinar por el desengaño que tuve.,['RESTAURANT'],['negative']
"Empecé el día con buen pie y lo continué escogiendo el lugar idóneo para comer, charlar  con los amigos y estar muy bien atendida.",['RESTAURANT'],['positive']
El local te ayuda a conseguir que puedas intercambiar ideas con  quienes compartes la mesa dado el bajo tono en que los comensales mantienen sus conversaciones.,['AMBIENCE'],['positive']
El servicio excelente.,['SERVICE'],['positive']
"Atentos, educados, discretos, todos cuantos nos atendieron y al despedirnos acudieron a darnos el último adios y el ""hasta la próxima.."" Prometimos volver pero esa vez con muchos más amigos a los que, previamente, habremos informado de ese almuerzo que nos redondeó un sábado inolvidable.","['RESTAURANT', 'SERVICE']","['positive', 'positive']"
Gracias.,['RESTAURANT'],['positive']
Es muy buen restaurante.,['RESTAURANT'],['positive']
"Este es mucho mas elegante, el trato muy correcto y la ambientacion te hace sentir muy a gusto.","['SERVICE', 'AMBIENCE']","['positive', 'positive']"
La comida de calidad.,['FOOD'],['positive']
Recomiendo los calçots rebozados.,['FOOD'],['positive']
Sin duda repetiremos.,['RESTAURANT'],['positive']
el restaurante y la comida estupenda.,"['RESTAURANT', 'FOOD']","['positive', 'positive']"
Pero la mujer que esta de cajera que fue quien nos recibio desde el primer momento nos hablo en catalan incluso dandose cuenta de que no lo entendiamos.,['SERVICE'],['negative']
Hemos comido bastante bien.,['RESTAURANT'],['positive']
"Los primeros bien, la carne excelente.",['FOOD'],['positive']
El trato exquisito.,['SERVICE'],['positive']
"Se nota que llevan un mes y medio y les falta un poco de rodaje, pero se le ven ganas de agradar para ganarse la clientela.",['RESTAURANT'],['neutral']
Deberían revisar las raciones que sirven: son realmente escasas!!,['FOOD'],['negative']
"Comida y servicio excelentes, única pega la ya mencionada; raciones muy ""minimalistas"".","['SERVICE', 'FOOD']","['positive', 'positive']"
"Por esto mismo no doy un 10 en ""calidad-precio"", aunque la calidad sea excelente.",['FOOD'],['positive']
"La reserva sin ningún problema, la atención inmejorable, preguntándonos si todo estaba en orden y el punto de la comida.","['RESTAURANT', 'SERVICE']","['positive', 'positive']"
"Destacar la presentación, todos los platos, muy buena.",['FOOD'],['positive']
"Y el lugar está muy bien decorado, sencillo, pero elegante.",['AMBIENCE'],['positive']
"Mi acompañante una sopa de cebolla, que de textura y de sabor estaban muy buenas, pero parecía poca cosa, porque en pocas cucharadas se acaba de comer enseguida.",['FOOD'],['positive']
"Y de segundo merluza con almejas en salsa verde, que eran pocos trozos, pero de primera calidad y muy bueno.",['FOOD'],['positive']
"Si bien agradecía que no fueran unas cantidades muy grandes, no es lo que se suele comer en casa.",['FOOD'],['neutral']
"Yo pedí foie con tostadas, que la cantidad era más que correcta, si bien había pocas tostadas para la cantidad que era de foie.",['FOOD'],['neutral']
"Muy buen sabor, en cualquier caso.",['FOOD'],['positive']
"Y el segundo, paletilla de ternasco, de tamaño un pelín escaso (era en forma de redondo) y muy rico.",['FOOD'],['positive']
"Sin embargo, yo que soy de comer bastante, me daba la sensación de comer poco.",['FOOD'],['negative']
Muy bueno y con helado de limón.,['FOOD'],['positive']
Lo que sí me da la sensación es de haber comido poco.,['FOOD'],['positive']
"Cosa que no me quedé con hambre, pero las raciones eran pequeñas en comparación con el precio.",['FOOD'],['negative']
Yo vi por ejemplo un plato de judías verdes que era una cantidad muy muy pequeña que eran los comensales vecinos que teníamos a nuestro lado.,['FOOD'],['negative']
"Está muy bien el lugar, estupendamente presentado, servicio inmejorable, buenos productos y de primera calidad, pero cantidades bajo mi punto de vista escasas, sobre todo si eres de comer mucho.","['FOOD', 'SERVICE', 'AMBIENCE']","['positive', 'positive', 'positive']"
"Hemos cenado muy bien, el menú montecito,la atención estupenda,El ambiente muy acogedor, la botella de vino de 500cc, se queda escasa para la cena.","['DRINKS', 'SERVICE', 'AMBIENCE', 'FOOD']","['positive', 'positive', 'positive', 'negative']"
"Es lo único reseñable, debería ser de 750cc,Bien calidad-precioLo recomiendo ",['RESTAURANT'],['positive']
Estuve este sabado pasado cenando y he de felicitar tanto al restaurante como al camarero que nos atendio y por supuesto la comida.,"['RESTAURANT', 'SERVICE', 'FOOD']","['positive', 'positive', 'positive']"
"Un sitio muy bonito, bien atendido, personal muy agradable, la comida bien servida y sin esperas y el sitio encantador.","['FOOD', 'SERVICE', 'AMBIENCE']","['positive', 'positive', 'positive']"
Volveremos.,['RESTAURANT'],['positive']
(El entrecotte de vaca estaba delicioso) ,['FOOD'],['positive']
aceptable.,['RESTAURANT'],['positive']
muy  bien cortado el jamon y de buena calidad.,['FOOD'],['positive']
bastante bien el resto fe lis entrantes.,['FOOD'],['positive']
"mejorables las costillas,ya que se anuncia costillas y se incluyen chuletas.",['FOOD'],['neutral']
en conjunto bien. ,['RESTAURANT'],['positive']
"Servicio bienentorno muy agradable, realmente recomendable podremos repetir seguro.En cuanto a la comida relación precio calidad buena, los platos bien servidos y con cantidad suficiente, no nos quedamos con hambre, estuvimos tres personas.Unicamente comentar que seguramente por la hora que eran casi las 5 de la tarde, las brasas no debian de estar en su punto puesto que tanto el entrecot de vaca como el ternasco no tenian la presencia de es primer golpe de calor que los pone doraditos.","['FOOD', 'RESTAURANT', 'SERVICE', 'AMBIENCE']","['positive', 'positive', 'positive', 'positive']"
Estaban buenos pero he comido brasas mejores.,['FOOD'],['neutral']
"Por lo demas todo perfecto, lo recomiendo y lo pongo entre mis favoritos.",['RESTAURANT'],['positive']
"Ayer Celebramos La Comunion De Nuestra Hija,Fue Un Dia De Lluvia,Pero No Importo Porque Nos Los Preparativos Estaban De Sobresaliente ,Tanto En El Local Como En Lo Demas,La Atencion De Los Camareros Fue Destacable La Comida Toda Fue Genial.El Ternasco Salio Bordado.Muchas Gracias Por Todo Sois Los Mejores. ","['RESTAURANT', 'SERVICE', 'FOOD']","['positive', 'positive', 'positive']"
"Trato agradable, buen servicio, la comida llegaba en su punto….","['SERVICE', 'FOOD']","['positive', 'positive']"
Hoy he ido a comer con mia padres y he salido muy defraudado.,['RESTAURANT'],['negative']
"La comida ha sido de lo más corriente comparada con el precio, 45€ por persona.",['FOOD'],['negative']
Creo que en esos precios hay que ser más exigente tanto en la calidad del menú como sobre todo en la calidad del servicio.,"['SERVICE', 'FOOD']","['negative', 'negative']"
Camareros con poca experiencia y poco preparados para el precio pagado.,['SERVICE'],['negative']
No volveré. ,['RESTAURANT'],['negative']
El sitio es muy acojedor y relacion calidad precio miy bien.,"['RESTAURANT', 'AMBIENCE']","['positive', 'positive']"
Lo recomiendo muy contento. ,['RESTAURANT'],['positive']
"15.01.09 vieira con sopa, 21€ sin gusto.",['FOOD'],['negative']
"presa iberica 30 € así no se presenta la presa ibérica, no me ha gustado, lo peor los postres, merengue, fresas…9€.","['RESTAURANT', 'FOOD']","['negative', 'negative']"
"no me quejo del precio, sino de la cocina.",['FOOD'],['negative']
Lo mejor el aperitivo. ,['FOOD'],['positive']
"el local gusta de entrada pero no llega a ser acogedor, pero eso no es lo que mas me importa, me fijo mas en el servicio de sala y cocina.el servicio de sala, correcto, (solo eso, falta una persona, por el precio que se paga).","['SERVICE', 'AMBIENCE']","['neutral', 'neutral']"
"el pan: escaso en sus variedades, y muy sencillo, sin ningun tipo de sabores, harinas o frutos.comenzamos: el agua, no pedimos ninguna rara, pues nadie nos dio la opcion, nos sacaron el agua embotellada en plastico (imcomprensible).","['DRINKS', 'FOOD']","['negative', 'negative']"
"comenzamos con un foie frio en crujientes de manzana, escaso , resultaria demasiado, (de verguenza) llevaria 30 grs de foie, lo demas correcto; huevo poche con bogavante y trigueros, correcto, cantidad suficiente, pero como toda la comida, plana,insulsa, sin sabores.presa iberica, racion justita, pero sabrosa, como he comentado antes todo soso (somos personas que nunca nos añadimos sal a las comidas en todos estos restaurante) merluza, una racion impresionante, tanto en tamaño como en punto de coccion, sosa tambien, pero recomendable.",['FOOD'],['negative']
"los postres, no aportan nada nuevo, simples, buenos pero nada mas.a los cafes, nada de pettite fours, (lamentable por 175 € de dos personas, sin cobrarnos los cafes). ","['DRINKS', 'RESTAURANT', 'FOOD']","['neutral', 'negative', 'negative']"
"La primera sorpresa fue que no nos preguntaran si deseábamos tomar un aperitivo, pero lo que más nos sorprendió que al pedir agua con gas nos dijeran que no se les había acabado.","['DRINKS', 'SERVICE']","['negative', 'negative']"
Me pareció imperdonable para un restaurante con aspiraciones.,['DRINKS'],['negative']
"Muy mala organización.Para este momento ya estábamos logrando acomodarnos en las sillas, muy modernas pero difíciles.","['SERVICE', 'AMBIENCE']","['negative', 'neutral']"
"Lo más destacable para mí fueron las excelentes verduras que acompañaron todos los platos, con unos puntos de cocción breves y ajustados, muy en la línea de Martín Berasategui.",['FOOD'],['positive']
Extraordinario el trabajo en este aspecto.,['FOOD'],['positive']
"El tomate en texturas estaba muy sabroso, aunque la espuma resultaba un tanto dura.",['FOOD'],['positive']
"Los espárragos, las judías verdes, la crema de coliflor, el broccoli,  todos muy bien tratados.",['FOOD'],['positive']
"Las combinaciones muy equilibradas,  tal vez la que menos decía era el tomate con el atún marinado, pero el bogavante y sobre todo el huevo poché, mucho mejor.",['FOOD'],['positive']
"Eso sí, un poco repetitivas las huevas, en los tres primeros platos.",['FOOD'],['negative']
"La merluza bien de punto, aunque un poco sosa, dio paso a lo que para mí fue la sorpresa del día, un trocito de chuletón exquisito de sabor y en su justo punto de cocción que me dejó con ganas de más.Los postres aprobado justito, el primero alrededor del vino tinto, con un sorbete para mí demasiado dominado por la canela y con una espuma de vino de nuevo demasiado consistente.",['FOOD'],['neutral']
Muy logrados los orejones y el sorbete.Otro punto negativo en el servicio fue que intente tomar un vino dulce y la respuesta fue decepcionante.,"['SERVICE', 'FOOD']","['positive', 'positive']"
"Al final pude tomar una copa de Pedro Ximénez.Con el café, que estaba muy bueno,  no hubo ningún acompañamiento, pobre, muy pobre para este nivel de restaurante.",['DRINKS'],['positive']
"El vino con que acompañamos la comida fue un Atteca de Calatayud, recomendación de la casa, excelente.",['DRINKS'],['positive']
"Como curiosidad,  ¡la botella etiquetada sólo en inglés y en francés!En resumen: muy buen nivel técnico, dominio de los puntos de cocción y gran profesionalidad en la cocina, combinaciones estéticamente modernas pero bastante conservadoras en lo que a sabores respecta - salvo en el trato a las verduras.",['FOOD'],['positive']
"De resaltar que todos los precios incluyen el IVA, un detalle que debería ser obligatorio.",['RESTAURANT'],['positive']
"En cuanto a defectos: Las cantidades, demasiado escasas.",['FOOD'],['negative']
"En los postres la ausencia del chocolate me parece personalmente imperdonable, pero eso ya es una cuestión personal.",['FOOD'],['negative']
"Lo peor, para mí, el servicio.",['SERVICE'],['negative']
"Muy justito, con algún fallo grave como el del agua o el del vino dulce, no estuvo a la altura de una estrella.","['DRINKS', 'RESTAURANT']","['negative', 'negative']"
"Yo comí este martes, y de maravilla; como siempre.",['RESTAURANT'],['positive']
"A mí me decepcionó también el restaurante, y lo que es peor, nos sirvieron un mero casi crudo que no había sido congelado previamente, incumpliendo de forma consciente la norma vigente al respecto (el propietario y cocinero se mostró especialmente “orgulloso” de no congelar los pescados).","['RESTAURANT', 'SERVICE', 'FOOD']","['negative', 'negative', 'negative']"
"Qué pena que no sepan diferenciar entre un pescado cocinado “en su punto” y un pescado directamente crudo, donde la carne no se desprende de la espina por falta de calor y cocción.",['SERVICE'],['negative']
"Y que conste que me encantan los “sushi” y los “sashimi”, pero una cosa es una preparación específica cumpliendo los requisitos para prevenir la ingesta de anisakis vivos y otra tomar un pescado salvaje poco cocinado, con gran probabilidad de existencia de parasitos activos.",['FOOD'],['negative']
"Qué pena que se confundan las cosas, no hay nada peor que un “enterado” mal informado, como es el caso de este cocinero. ",['SERVICE'],['negative']
"Por otro lado me alegro de coincidir con usted en los gustos, no tanto de que ambos saliéramos decepcionados de este restaurante, porque supongo que a usted, igual que a mi, nos hubiera gustado salir contentísimos del Bal d’Onsera, recomendarlo por doquier y no tener la sensación de haber perdido tiempo y dinero, al menos yo.",['RESTAURANT'],['negative']
"Pocas veces coincide la opinión de uno mismo con la de otros “criticos gastronómicos”, pero pocas veces he podido estar más de acuerdo que con la de D. José Aranda:Mi mujer y yo fuimos el pasado 25 de mayo (martes)a celebrar algo especial a este restaurante y salimos decepcionados.",['RESTAURANT'],['negative']
Nos planteamos el porqué de su estrella y nos dolió el bolsillo.,['RESTAURANT'],['negative']
La verdad no me acuerdo de ningun plato del menú degustación que tomanos (sintomático).,['FOOD'],['negative']
"Tan solo recuerdo una sosísima y poco fresca merluza.Cuando vas a un lugar de estos esperas todo y tal vez te vuelvas menos permisivo que con otros, pero aun con esto no merece la pena el restaurante.","['RESTAURANT', 'FOOD']","['negative', 'negative']"
"A mí personalmente no me gusta ni la calle ni la zona de Zaragoza (debería estar más céntrico), pero dicho esto si que valoro y mucho la amplitud de las mesas redondas (que no me puedo explicar desde el punto de vista económico dado que si todas las mesas se ocupan sólo por dos comensales significa una menor facturación).","['LOCATION', 'AMBIENCE']","['negative', 'positive']"
Es un gozo y deleite tener una mesa con mantel tan grande para tí y tu acompañante.,['AMBIENCE'],['positive']
Para mí el SERVICIO de este restaurante lo valoro como de los mejores porque no molestan.,['SERVICE'],['positive']
Ambas dos muy discretas como se requiere en este tipo de establecimeinto.,['SERVICE'],['positive']
"-LA CARTA DE VINOS: Desgraciadamente no me considero un experto  pero dado las dimensiones tan reducidas del local, me parece una carta muy acertada.",['DRINKS'],['positive']
"Además me sorprende la promoción de los mejores vinos de nuestra región, cosa que no he visto apostar por ellos tanto como este restaurante.Los precios?",['DRINKS'],['positive']
Permítame decirle que no puede valer el mismo vino en este establecimiento que en cualquier otro.,['DRINKS'],['positive']
LA CARTA: En este punto coincido en su acierto de pedir el menú degustación.,['FOOD'],['positive']
Aquí es donde el cocinero nos puede sorprender y deleitar con su saber hacer.Yo tengo que reconocer que la 1º vez me sorprendió gratamente.,['SERVICE'],['positive']
Experimenté sensaciones diferentes y fue un placer culinario que pocas veces había experimentado.,['FOOD'],['positive']
"Entonces no tenía la Estrella Michelín pero ya se podía intuir que iba a caer.La cocina es imaginativa, moderna, sofisticada, etc¿Que se quedó con hambre?",['FOOD'],['positive']
Pues no me lo creo.,['FOOD'],['positive']
"Si no te gusta tienes los WOK que es un self-service hasta que no puedas más…  Por terminar, le diré que a este restaurante le faltan cosas.",['RESTAURANT'],['negative']
De lo que estoy de acuerdo totalmente con usted es del maridaje de los vinos.,['SERVICE'],['negative']
¿Cómo vamos a pedir un  vino si no somos adivinos de los platos que nos van a sacar?En este punto fallan.,['SERVICE'],['negative']
"Y respecto al precio, pues es el que es.",['RESTAURANT'],['neutral']
"Un último comentario a favor del cocinero es que el pasado año estuvo invitado en la pasada Expo en China (salió en prensa), y los platos que presentó en la semana española eran típicos aragoneses (borraja, ternasco… y todo con vinos aragoneses).Con esto lo único que quiero indicar es mi sorpresa por la propaganda de la comida aragonesa, cosa que me alegro que alguien la defienda ( y lo dice un aragonés español).",['SERVICE'],['positive']
"Para Gonzalo, le voy a contestar brevemente: No me gusta que me peloteen, al personal de sala tampoco le gusta hacerlo, pero a veces hay que reconocer que entra dentro de su “labor” porque hay a quién le gusta, pero es distinto pelotear que interesarse por el bienestar de los comensales, sobre todo cuando se llevan un plato enterito de nuevo a cocina, un “¿no les ha gustado?”, “¿está todo bien?”, a la hora de recoger los platos no molesta,no es peloteo, es educación.",['SERVICE'],['negative']
"Dice que no me cree cuando comento que no entendía a la persona que me traía los platos cuando los presentaba, pues le puedo asegurar que la chica no hablaba castellano ni a medias, ¿qué quiere que le diga?, si quiere pregunte en el restaurante el personal que tenían para esas fechas, es algo tan sencillo de validar que no merece más palabras.",['SERVICE'],['negative']
"Tampoco se cree que me quedé con hambre, pues sí, me quedé con hambre, y a mi me gusta cuando voy a comer a un restaurante, independientemente del nivel y precio, salir comido, sino no lo llamaría ir a comer… podríamos decir ¿vamos a una exhibición de cocina al restaurante Bal d’ Onsera donde incluso, por 80 euros por persona, nos permiten probar un poquito de cada creación?, pero eso sí, luego a comer nos vamos a casa.",['FOOD'],['negative']
"Buenos días,Soy una cliente habitual de este restaurante y una convencida de este tipo de cocina.",['RESTAURANT'],['positive']
(pense).El resultado no pudo ser mas decepcionante.,['RESTAURANT'],['negative']
"Para empezar la puerta parece la del almacen, llamas al portero automatico y te abren (aunque esto me direis que es secundario).",['AMBIENCE'],['negative']
"Una vez dentro la decoracion es como le gustaria a mi mujer que fuera la de nuestra casa: minimalista.Del mobiliario solo decir un par de cosas: las sillas incomodas y las mesas del tamaño de “La Misericordia”, si no acercamos las sillas entre si parece que estoy comiendo enfadado con mi mujer.",['AMBIENCE'],['negative']
"Para finalizar con los previos antes de entrar con la comida un comentario: un poquito de musica de ambiente daria intimidad, se oia todo lo que se decia en las otras 5 mesas que estaban ocupadas (todas ellas con parejas con cupones de descuento como nosotros).",['AMBIENCE'],['negative']
"- Carpaccio de bonito: Seria bonito, no lo discuto, pero no me supo a nada, totalmente insipido, tambien tenia remolacha, igual de insipida, y un helado de, creo recordar que de mango, que si tenia algun sabor.",['FOOD'],['negative']
"- Vieira y langostino al azafran con verduras de invierno: Si observais en el nombre del plato esta en singular la vieira y el langostino y el motivo no es otro que habia uno de cada, en este caso los sabores, imposible de eliminar, eran correctos, el azafran estar estaria, pero ni me supo ni lo vi.",['FOOD'],['negative']
-Bacalao al pil pil aireado: Ninguna objecion (es lo mejor que puedo decir).,['FOOD'],['neutral']
"-Risotto de hongos trufa y foie: El foie tiene poco misterio una sarten y nada mas, es muy dificil estropearlo,ahora bien el risotto corrio peor suerte, era risotto, de eso estoy seguro, por que lo vi, granos de arroz y demas pero sabor, eso si muy intenso, a nata y solo a nata.",['FOOD'],['negative']
"- Carrillera de ternera glaseada: Blanda como la mantequilla pero no sabia a nada de nada, totalmente insulsa.",['FOOD'],['negative']
"- Limon, mango y moscatel, fresas con vino: El postre estaba bueno (sin mas).Terminamos la comida con un Gin Tonic con preparacion gourmet (ponia en el cupon de descuento): El combinado salio prepado de la cocina.",['FOOD'],['positive']
"Lamento ser yo quien os diga que los combinados se preparan en la mesa, de la cocina sale el vaso (o lo que sea, en este caso copa) con el hielo y la rodajita de limon, lima o lo que sea y la ginebra se sirve delante del cliente al igual que la tonica, no es por suspicacia es por practica habitual (no se me pasa por la mente dudar de los ingredientes pero no queda bien).",['DRINKS'],['negative']
"Ahora es el turno del servicio: correcto en el trato pero lento es poco, entre plato y plato unos tiempos de espera inaceptable.He dejado para el final un pequeño detalle, para algunos sin importancia, y es el tamaño de las raciones: Se puede poner menos en cada uno de los platos pero eso es muy muy dificil (menos mal que habiamos tomado el aperitivo en Palomeque donde las raciones si son generosas)Con todo esto mi opinion creo que queda clara y añadire solo una cosa mas: Sali sintiendome estafado ","['RESTAURANT', 'SERVICE', 'FOOD']","['negative', 'negative', 'negative']"
"Al sentarnos a la mesa, ya nos dicen que el solomillo de ternera se les había terminado (principio de semana, primeros en llegar a cenar, con un menú cerrado y avisando con dos semanas de tiempo….), que nos darían chuleta de ternera… primer chasco, creo que no es comparable (y desde luego, no lo fue, requería masticarlo muuucho tiempo).",['FOOD'],['negative']
"Seguidamente de advertirnos el cambio, nos pregunta si un vino blanco nos parecía bien para empezar, por lo que, ante esa pregunta, le comenté si no iban a servir los tres vinos que aparecían en el cupón, a lo que nos respondió que una de las bodegas, no les suministraba hasta noviembre…algo que a mi personalmente, me parece estupendo… pero no nos lo iban a servir!!!, ya que habían considerado suficiente dos vinos, uno blanco y uno tinto..  Me parece que cuando has pagado por un menú cerrado, se deberían de ajustar a lo que has comprado, ya que si no, es una estafa, y si luego ven que no tienen margen suficiente, cuando saquen otro bono, que ajusten el menú a lo que les parezca, así el consumidor puede elegir antes de comprar.Pues no acaba todo ahí, le preguntamos por el cava y nos dice, que tampoco lo servían, que creían que el menú está bien así!!!","['DRINKS', 'RESTAURANT']","['negative', 'negative']"
"Por supuesto, como era un momento especial, no quise montar ningún circo, ni pedir el libro de reclamaciones, pero la sensación con la que salí de ese restaurante no fue buena, me sentí estafada.En fin, que no lo aconsejo para nada, el sitio es bonito, la comida buena, pero excesivamente caro para lo que realmente es, y por supuesto, no animo a nadie a que compre cupones para comer allí, puesto que se arriesgan a que les sirvan lo que ellos consideren en ese momento, independientemente de lo que hayas pagado con anterioridad. ","['FOOD', 'RESTAURANT', 'AMBIENCE']","['negative', 'negative', 'positive']"
"Estube ayer dia 22 de febrero en el restaurante bal d’osera y mi sorpresa fue que primero se disculpan porque aun no tienen percheros, luego las mesas tambien te dicen que son provisonales (que no hubieran abierto aun, si no podian) porque el precio desde luego no lo han bajado.",['AMBIENCE'],['negative']
"Para mi con esta reforma a perdido encanto, pues estas cenando sin privacidad, viendo y oyendo a la gente que hay en la barra del bar.",['AMBIENCE'],['negative']
Con lo cual en el comedor tienes que levantar mas la voz para oirte y se forma un ambiente que no lo que se espera de una estrella michelin. ,['AMBIENCE'],['negative']
